{
  "schema_version": "1.0",
  "paper_id": "local:wifi-csi:80a3a4a0ed8262b0",
  "slug": "2024-yan-person-in-wifi-3d",
  "title": "",
  "metadata_status": "needs_review",
  "authors": [],
  "year": 2024,
  "category": "wifi-csi",
  "topics": [],
  "publication": {
    "venue": null,
    "status": "unknown",
    "verified": false,
    "verification_sources": []
  },
  "abstract": "",
  "one_line_summary": "",
  "source": {
    "urls": [],
    "pdf_path": "01-Papers/pdfs/wifi-csi/2024-yan-person-in-wifi-3d.pdf",
    "review_path": null,
    "uploaded_filename": null
  },
  "reading_status": "candidate",
  "review": {
    "problem_and_prior_work": {
      "summary": "",
      "claims": []
    },
    "core_idea_and_difference": {
      "summary": "",
      "claims": []
    },
    "evaluation_and_evidence": {
      "summary": "",
      "claims": []
    },
    "limitations_and_future_work": {
      "summary": "",
      "claims": []
    },
    "related_work": {
      "summary": "",
      "claims": []
    }
  },
  "relationships": [],
  "structured_review_status": "pending"
}
