{
  "schema_version": "1.0",
  "paper_id": "local:agent-ai:7be67a40a393fe1c",
  "slug": "2026-jiang-octot2i-agentic-text-to-image",
  "title": "",
  "metadata_status": "needs_review",
  "authors": [],
  "year": 2026,
  "category": "agent-ai",
  "topics": [],
  "publication": {
    "venue": null,
    "status": "unknown",
    "verified": false,
    "verification_sources": []
  },
  "abstract": "",
  "one_line_summary": "",
  "source": {
    "urls": [],
    "pdf_path": "01-Papers/pdfs/agent-ai/2026-jiang-octot2i-agentic-text-to-image.pdf",
    "review_path": null,
    "uploaded_filename": null
  },
  "reading_status": "candidate",
  "review": {
    "problem_and_prior_work": {
      "summary": "",
      "claims": []
    },
    "core_idea_and_difference": {
      "summary": "",
      "claims": []
    },
    "evaluation_and_evidence": {
      "summary": "",
      "claims": []
    },
    "limitations_and_future_work": {
      "summary": "",
      "claims": []
    },
    "related_work": {
      "summary": "",
      "claims": []
    }
  },
  "relationships": [],
  "structured_review_status": "pending"
}
